{
  "$schema": "http://json-schema.org/draft-07/schema#",
  "$id": "https://aronnax.eu/wsa.schema.json",
  "title": "Wine Selector Assistant items",
  "description": "Items tree",
  "type": "array",
  "items": {
    "type": "object",
    "properties": {
      "label": {
        "type": "string"
      },
      "imageSrc": {
        "type": ["string","null"]
      },
      "targetHref": {
        "type": ["string","null"]
      },
      "children": {
          "$ref": "#"
      }
    },
    "required": ["label"]
  }
}